[
  {
    "group_id": "1",
    "barcode": "017.018",
    "type": "escape_path",
    "priority": "1"
  },
  {
    "group_id": "1",
    "barcode": "017.017",
    "type": "escape_path",
    "priority": "1"
  },
  {
    "group_id": "1",
    "barcode": "018.018",
    "type": "escape_path",
    "priority": "1"
  },
  {
    "group_id": "1",
    "barcode": "018.017",
    "type": "escape_path",
    "priority": "1"
  },
  { "group_id": "2", "barcode": "017.015", "type": "shutter", "priority": "0" },
  { "group_id": "2", "barcode": "018.015", "type": "shutter", "priority": "0" }
]
